channel,content,date,title,url
topics,"在中国新经济企业“境内赚钱、境外分红”的尴尬局面下，建议引入CDR（中国存托凭证）制度，为中国资本市场提供更多的优秀投资标的。全国政协委员、九三学社中央常委、中投公司首席风险官赵海英在本次“两会”上提出了一份题为《引入CDR（中国存托凭证）  推进资本市场供给侧改革》的提案（附后）。 赵海英在2005年加入中投之前，在中国证监会工作，曾为规划委和发行监管部副主任。她2012年开始任中投公司执委，2015年任中投公司首席风险官。 两会开始前夕，证监会对“新经济”表现出前所未有的欢迎和拥抱姿态。证监会会同沪深交易所密集调研“BATJ”（百度、阿里巴巴、腾讯和京东）以及相关概念的企业，向它们伸出A股上市邀请的橄榄枝。 这一问题进而成为“两会”头几天的热门话题。证监会副主席阎庆民6日在参加政协经济界联组讨论后接受采访时，对海外新经济企业回归适合发行A股IPO还是采用CDR的方式回应称，CDR的方式更合适，这也是国际惯例。但他亦表示，新经济企业的认定标准还需要各部门研究确定。 就选择哪些新经济企业发行CDR，赵海英在接受财新记者采访时建议，有两类可考虑，一是那些在境外交易比较活跃、相对成熟的企业。 之所以选交易比较活跃的企业，是因为国外成熟市场上，有的股票不是很受投资者欢迎，交投不是很充分、比较冷淡，这种情况下其价格不能很好地反映这家企业的价值。选择交易比较充分的，意味着这家企业的市场认可度相对较高。 她指出，中国股市目前的投资者结构还不是非常好，定价能力还不是很强，常出现市场定价偏离企业真实价值的情况。因此有必要考虑此类企业。 另一类在她看来可以是那些未来准备在境外市场进行IPO的中国新经济企业。让他们在海外上市的同时在国内发CDR，这一做法的好处是，境内投资者可以享受一些首发的获益机会。新经济企业首发通常有较大的上涨，而前一类已在海外上市企业的价格已经交易很多年。 据财新记者了解，相关部门希望把筛选标准从10亿美元的“独角兽”估值阈值提高到50亿美元。这样，垂青的实为BATJ几家大巨头以及第二梯队如滴滴出行和美团点评等小巨头。（参见财新周刊2018年第9期封面报道“为独角兽开闸”） 赵海英认为，以10亿美元、50亿美元等估值阈值来选择哪些企业可引入CDR，未见得是最好的标准，有些独角兽并不一定永远是独角兽。还是应有所选择、适当优先考虑前述两类企业。 引入CDR，在一些人看来目前还存在一些技术问题，包括人民币无法完全自由兑换、监管分割、管辖区法律适用问题等。 在赵海英看来，一个比较重要的技术问题是，是否允许跨市场套利的选择和设计。如果允许，不同市场之间的价格就会拉得比较平，不会像A股和H股之间这样，有时会出现比较大的差价。 对于外界最关心的定价和价差问题，她举例表示，如果一家中国企业在美国市场的价格高于在中国市场的价格，那么有些人就可以在中国市场买了CDR后、注销掉，把券拿到美国市场去，以更高的价格卖掉。这样的套利行为如果在制度设计，以及具体环节可操作性上被允许，那么两边的价格自然会拉得比较平。 这一选择在她看来也是相对更进取的。好处在于，一家企业境内、外的定价会更接近，对国内了解和学习国际市场的定价也有帮助。 第二种方式是用一种更谨慎的方式，即不允许跨境的套利、流通。在这一选择下，发行完了，两边价格可能会出现差距。这种情况在初期阶段未尝不可，“但是我个人倾向于第一种方式”。她坦言。 虽然人民币还没有实现资本项下可兑换，但是第一种方式的开口，口子还是开在单一企业这一块，风险相对可控，而且对人民币资本项可兑换会有促进作用。她说。 不过，对于中国资本市场的改革重任，赵海英还是对财新记者强调，引入这些公司来治标无疑有帮助，但最终仍需要标本兼治。治本包括，培育机构投资者、加快养老金、退休金等长期资金的入市和专业化管理等。 只有这样，经过几年时间，“我们的投资者结构才会更完善、更成熟，未来才能不需要再面临我们现在所面临的标、本都需要治的情况”。她说，“因为如果投资者不能够自己去选择企业、为企业合理定价，我们就无法逃离审批的怪圈，整个发行市场的改革就很难往前推进，永远会面临像现在说的：必须是哪些企业可以让他来，而不是只要企业合格，他就可以发行，让市场来决定谁发得出去。” 附全国政协委员赵海英2018年两会提案： 引入CDR  推进资本市场供给侧改革 党的十九大报告指出,创新是引领发展的第一动力,是建设现代化经济体系的战略支撑。创新企业的发展与资本市场密不可分，资本市场的供给侧改革对创新企业至关重要。 纵观美国的谷歌、微软等高科技创新公司，其发展无不高度依赖资于资本市场的支撑。而我国资本市场对高科技企业的服务能力仍然不足，国内一大批优秀的高科技创新公司选择赴美或者香港上市，如阿里巴巴、京东、百度在美国上市，腾讯在香港上市。这一方面使得中国内地的投资者难以分享这些优秀高增长企业带来的投资机会，造成企业“境内赚钱、境外分红”的尴尬局面；也使得这些创新企业难以从中国获取融资，支持自身的发展。 高科技企业境内上市面临两个问题，一是在我国当前的《公司法》和《证券法》法律架构下，因为盈利门槛、VIE结构以及同股不同权等问题，境内上市融资面临法律障碍。拆除VIE结构对部分高科技企业来说，流程十分复杂，不容易操作。二是与成熟行业不同，高科技创新公司面临的不确定性更高，如何合理定价、避免过度投机炒作和金融风险，对投资者、投资银行、监管者都提出了更高的要求。需要到位的信息披露，同时更需要投资者有相应的专业知识和实践经验，以很好地对高科技创新企业进行判断和定价。 我国当前资本市场的投资者结构仍不合理：投资者不够多元化，机构投资者比例偏小；投资者期限结构偏短，缺少长期机构投资者；公募基金因为资金来源主要是个人投资者，投资行为有短期化和散户化的趋势；投资者风险偏好趋同。这种投资者结构下，羊群效应、暴涨暴跌、投机炒作难以避免，市场定价功能失真、市场资源配置功能扭曲。 投资者结构不合理，就好比盐碱地，无法生长出健硕的禾苗。不进行盐碱地改造，很多资本市场改革可能事与愿违，比如IPO发行，不是由市场决定发行成败、发行定价，长期依赖审批把关，就是因为投资者结构不够合理、市场不够成熟，落入“一抓就死、一放就乱“的怪圈，改革效果难以保障。即便修订相关法律法规，让高科技创新企业在国内资本市场直接上市融资，也可能因为资本市场的价格发现功能和公司治理功能短板，带来诸多乱象、问题、和风险。 在此背景下，建议在我国引入CDR（中国存托凭证）制度。所谓DR（存托凭证），也即Depository Receipts，是一种在一国证券市场发行的、代表境外上市公司有价证券的可转让凭证。摩根大通最早发明了存托凭证,由于在美国发行，其也被叫做ADR（AmericanDepository Receipts美国存托凭证）。之后ADR也逐渐成为美国境外企业赴美融资的主要方式，存托凭证的发行也成为全球的趋势，如欧洲发行的EDR等。我国的中国石油、中国石化等一大批企业也通过ADR方式赴美上市融资。存托凭证的持有人也是寄存部分股票的实际所有人，其拥有与境外股票持有人相同的权利。 引入CDR （中国存托凭证）有诸多优势： 第一，可以为我国资本市场提供更多的优秀投资标的。 第二，不需要高科技创新公司拆解VIE结构，不违背目前法律，比较容易操作。已在境外上市的高科技创新公司发行CDR简单易行，有国际先例可循。 即使尚未IPO的企业也可以在境外IPO的同时，在国内以相同价格发行CDR，使得国内投资者可以相同价格进行认购，享受首发红利。 第三，有利于机构投资者的发育和资本市场功能的完善，推进资本市场的供给侧改革。CDR制度可以帮助国内投资者逐渐熟悉高科技创新企业，了解国外发达市场的定价机制，积累实践经验，提升定价能力。这也为后续修订相关法律，为高科技创新企业直接在国内上市打好基础。 具体建议有几点：一是引入CDR机制。二是加快养老金、退休金等长期资金的入市和专业化投资管理，改善投资者结构。三是引入境外的优秀资产管理公司，提升我国资本市场对高科技企业定价能力，也为我国的机构投资者提供更好的观察和学习机会。",2018/3/7,中投赵海英：引入CDR 治标长期需治本,http://topics.caixin.com/2018-03-07/101217850.html
promote,"上海，2018年2月28日 ——金犬贺喜，万象更新。在中国迎来改革开放壮丽史诗的四十周年之际，也正阔步迈向铸就中国梦的新发展时期，中国第一大化妆品集团欧莱雅在2017年以两位数强劲增长的非凡业绩，作为其在华廿载良好发展的最好见证，正式开启在华第二个20年的美丽征程，献礼中国美。欧莱雅集团新晋管理委员会成员兼欧莱雅中国首席执行官斯铂涵先生携中国高层管理团队与各路嘉宾在上海共同回顾过往战绩，并一同揭晓历史新阶段的战略蓝图，致敬美丽事业的“新黄金时代”。 欧莱雅集团新晋管理委员会成员，欧莱雅中国首席执行官斯铂涵先生携众致敬“美的新黄金时代” 放眼当下，美正在被赋予前所未有的全新定义。随着中国市场消费结构的不断升级以及城市化进程的不断深化，消费者对美妆产品及服务的需求不断增长，高端消费趋势加速兴起；主导品质生活的中产阶级、超过 4 亿人口的千禧一代以及收入可观、生活富足的“新银族”等正在成为崛起的新消费主力军，引领美妆领域的新潮流——这一切都助力蓬勃发展的中国美妆市场开启新黄金时代。  “二十坚守，折桂中华”——欧莱雅以消费者为中心缔造隽永传奇：2017年服务超1亿消费者，每天给他们带来至少1件新产品；持续引领创新突破，在电商销售雄踞中国美妆行业第一；四大业务部门均实现取得卓越成就——高档化妆品部取得惊人业绩增长，率先把握消费升级和彩妆风潮的蓬勃机遇，巩固行业领先地位，尤其值得一提的是兰蔻稳坐中国第一高档化妆品品牌以及圣罗兰美妆的现象级效应；大众化妆品部增长不断加速并进一步夯实消费者梦寐以求的品牌组合，尤其归功于中国第一美妆品牌巴黎欧莱雅，中国第一彩妆品牌美宝莲，以及美即强势回归，表现突出；活性健康化妆品部牢牢抓住消费者对健康和安全迅速上升的需求，增长充满活力；专业美发产品部不断升级业务模式，强化潮流染发与奢华护理专家的市场形象和地位，以期引领未来市场！ 中国第一大化妆品集团欧莱雅在2017年以两位数强劲增长的非凡业绩献礼中国美 欧莱雅中国始终以勇者之心矗立潮头，斯铂涵先生将折桂中华的致胜秘籍诠释为：以消费者中心的“欧莱雅中国五力模型”： 一、令人向往的品牌和产品：巩固致胜根基； 二、卓越创新：持续加码，不仅满足消费者需求，更致力创造新的需求； 三、创意新营销：探索颠覆性内容，通过全渠道直击目标消费者，培育超级消费者； 四、引领新零售：线上融合线下（O+O）的渠道创新，创造贯穿整个消费路径的沉浸式体验； 五、赋予社会价值：不断拓展企业社会价值的边界，赋予美全新的定义。  展望2018年，欧莱雅对中国市场充满信心，将继续加大对市场、产品研发、生产、人才等投入，以最大程度满足消费升级后的多元化需求：计划推出新品牌并不断完善独特品牌组合，以满足万千消费者更加个性化的需求；将致力于把羽西打造成为中国第一本土高档美妆品牌，完美演绎中国摩登美的高端升华；同时不懈发力美即的研发创新，引领市场发展；继续引领数字革命浪潮，不断开拓电商版图，与领先电商平台，如天猫、京东、唯品会等进一步紧密合作，不断探索并引领新零售的创新模式，以最终惠及消费者，并推动市场在新模式下的健康且长期的发展。 欧莱雅集团新晋管理委员会成员，欧莱雅中国首席执行官斯铂涵先生致辞  谈及欧莱雅在中国开启下一个20年后的的未来发展，斯铂涵先生充满信心：“这是最好的时代，机遇永远与挑战同在。不变在心，变革在行。时势造英雄，勇者造时势——这是我们永恒的信念。让我们共同开启美的新黄金时代。为打造‘美好生活’，实现‘中国梦’，共同谱写美的篇章。”  –完 –    关于欧莱雅中国 全球最大的化妆品集团欧莱雅在1997年进入中国。欧莱雅中国的总部位于上海，并在全国设有五个办事处，目前在中国拥有23个品牌，一个研发和创新中心，一个培训中心，两家工厂分别位于苏州和宜昌，和五个分销中心，共有超过8,100名员工。经过20年高质量、稳健、可持续的增长，欧莱雅中国已成为欧莱雅集团全球第二大市场，并成功登顶中国化妆品行业第一，同时，其蝉联多年优兴咨询“中国最具吸引力雇主”之一。作为中国最佳企业公民之一，欧莱雅中国始终贯彻落实集团提出的“美丽，与众共享——可持续发展承诺2020”。 敬请关注欧莱雅中国官方微信账号及官方网站 www.lorealchina.com    媒体垂询：  *本文刊发在财新promotion频道，不代表财新网编辑部观点",2018/3/6,勇者造时势 致敬美的黄金时代 欧莱雅中国以两位数强势增长 共启新廿载篇章,http://promote.caixin.com/2018-03-06/101217582.html
topics,2018年全国“两会”的头三天，支持优质创新型企业在国内上市融资成为会场内外最热闹的话题。不过在会场的另一些角落，一些代表、委员对新经济企业获得的“待遇”也表达了稍显保留的意见。 在3月5日下午举行的上海代表团全团审议上，全国人大代表、上海代表团有名的“犀利姐”樊芸接连向到会听取审议意见的证监会主席刘士余抛出四个问题，并现场喊话“刘主席能不能解答一下”。现场，刘主席笑而未语。 她的第三问为，“独角兽”企业回归A股成热点，快速通道之下，证监会有没有制定评价标准，什么样的企业算是“独角兽”企业？（参见财新周刊2018年第9期封面文章“为独角兽开闸”）,2018/3/6,多位两会代表委员建言 对新经济企业支持应审慎适度,http://topics.caixin.com/2018-03-06/101217551.html
opinion,3月5日，李克强总理作的政府工作报告重点提到“平台经济”。政府工作报告表示，鼓励大企业、高校和科研院所开放创新资源，发展平台经济、共享经济，形成线上线下结合、产学研用协同、大中小企业融合的创新创业格局，打造双创“升级版”。 当今社会，平台经济的重要性不言而喻。马克思在《哲学的贫困》曾经说过，“手推磨产生的是封建主为首的社会，蒸汽磨产生的是以工业资本家为首的社会”。 套用马克思的逻辑，我们可以给出如下判断：“互联网产生的是以平台企业家为首的社会”。,2018/3/5,平台竞争和治理再思考：“剥削者”抑或“守望者”,http://opinion.caixin.com/2018-03-05/101217235.html
economy,个人所得税改革，天下何人不关心？2018年全国两会刚刚拉开序幕，个人所得税再次成为焦点。 今年全国工商联的提案建议，将个税起征点（即免征额）从目前的3500元提升至7000元，并降低个人所得税最高边际税率，从3%-45%降至3%-30%以下。 全国人大代表、格力电器董事长董明珠则建议提高到1万元，“起征点提高后，个税应由富人承担” 。而她在去年提交给全国人大的议案中，这一数字还是5000元。,2018/3/4,特稿|降低个税可能吗？一文读懂个税改革逻辑,http://economy.caixin.com/2018-03-04/101216612.html
topics,3月3日，全国人大代表、腾讯董事局主席马化腾在北京举行媒体沟通会。今年，马化腾再次就“数字中国”概念提出建议，“一大五小”对工业、文化，金融、医疗和教育五个领域建言。第二次对建设粤港澳大湾区建设和环境保护提出建议。 建议之外，马化腾就防控金融风险、区块链、智慧零售、小程序、微信红包和国际化、腾讯投资等话题回答记者提问。 马化腾2015年提出“互联网+”概念，当年进入中国政府报告，2017年将此概念延展为数字中国：“主要是纵向延展。到了数字经济之后，我们再横向扩展，到民生、政务等等，形成了数字中国这样一个概念。所以，一纵一横的发展逻辑是我们在梳理这五六年时间的感受。”,2018/3/4,马化腾建言五领域落地“数字中国” 解释腾讯投资逻辑,http://topics.caixin.com/2018-03-04/101216583.html
finance,全国两会进行中，来自科技巨头的“代表委员”备受关注。恰逢证券监管部门为A股市场欢迎新经济企业上市轮番造势，李彦宏、丁磊等科技大佬纷纷抢先表态，表示愿意在国内A股上市。不过，表态与现实尚有不小距离。即便中国证监会矢志创新，快马加鞭的解决技术障碍，这些从股权架构到投资人背景都迥异于过去传统行业上市公司的大小巨头，可能仍然很难适应国内资本市场。 话要从头说，中国证监会为何突然要给科技“独角兽”，特别是大小巨头们敞开大门？一方面是落实中央政策，支持科技型企业发展的政治需要；另一方面也是证监会深感2016年以来IPO加速发行，新上市公司整体质量却没有显著提高，存在不小的隐忧。2017年10月，在证监会主席刘士余主导下合并后的新一届大发审委杀伐决断，IPO发行审核过会率陡降，一时间投行和拟发行企业哀鸿遍野。 证监会召集发审委员开会，明确要求委员们“敢于否决”；也召集券商负责人开会，要求主动清退有瑕疵的企业。对于那些带病申报，又不肯撤材料的企业抱着侥幸心理的企业，发行部出台新政策，明确一旦IPO被否，相关企业三年内也不能借壳。 这一系列政策，都旨在调整市场预期，让资质差的传统行业企业知难而退，为A股市迎接新经济企业腾出空间。以行政方式调整市场行为，一直是中国特色，为舆论诟病；从现实看，更早一个时期IPO过会率高，也确实有相当一批连规范性还有欠缺的企业涌入发行排队管道，希望边排队边规范。当证监会希望调整政策支持新经济企业的时候，排队中的这些企业自然被视作绊脚石。 不过新经济到底如何定义？证监会高层官员给出了“四新”，即“新技术、新产业、新业态和新模式”。这个提法仍然很模糊。而市场人士则流传着某几个行业“独角兽”将获得特别优待的说法，一时间股权投资圈沸腾了，人人热议谁将会成为“独角兽”。 国际惯例，10亿美元估值的项目一般被称为“独角兽”，这样的项目在中国已有不少。最新一期财新周刊封面报道《为“独角兽”开闸》独家揭示，中国证监会对独角兽的定义和标准 ，监管当局真正中意的，还是BATJ（百度、阿里、腾讯、京东）等已经在海外上市的科技巨头，以及还未上市、但估值和市场影响都相当了得的小巨头们，如美团点评、滴滴出行等，具体名单请见有关报道内文。 如何让这些企业在A股上市？通常理解的上市，是IPO，即首次公开发行，受国内的证券法和公司法规范调整。这两部法律对IPO公司的股权结构、盈利情况有比较严格的规制。比如公司法规定同股同权，证券法要求持续盈利。这两道框框，就能把绝大多数科技企业挡在门外——上市的巨头大多创始人有特殊股，阿里早年未能在香港上市就是受制于香港证监会不肯在同股同权问题上让步。 目前香港已经有望放宽这一限制，香港联交所总裁李小加功不可没。实际上，香港要改变成规，并没有法律上多少障碍。但是内地市场要改变上市规则，就必须修法。公司法、证券法的修订都大费周章，事实上2015年股市异常波动之后证券法的修订就遇到很大困难，拖延至今未有结果。 变通的办法不是没有，还是现成的。财新周刊封面报道《为“独角兽”开闸》独家揭示，政策当局正在推进的解决方案就是不以IPO上市，而是祭出2000年以来就反复讨论过的中国存托凭证（CDR）。这篇报道的作者是财新金融记者刘彩萍、张榆、公司记者屈运栩等，全文共8000多字，详细解读了这一方案的来龙去脉，涉及哪些监管当局看重的公司，标准是什么。 报道还指出，CDR也仅仅是权宜之计，它看起来是能绕过一些障碍，却不可能一夜间改变国内资本市场环境。一方面新经济公司体量庞大，而A股市场散户众多，是会对市场造成冲击，还是会出现爆炒？另一方面，这些科技公司自身的投资者结构复杂，诉求不尽一致，而境内资本市场并不是一个成熟的依据规则运行的市场，今天给特殊通道，明天会不会戴紧箍咒？ 而和科技巨头们两会上的“表态”对照，被选公司们则有各种现实考虑，其中也不乏顾虑。本期封面报道辅文《大小巨头各自盘算》在遍访各家被圈定的独角兽们后就指出，实际情况可能与监管者的设想还有距离。 这篇报道中的独家内容很多。目前为止，最有可能以CDR落地A股的，还只有一个过去善于饥饿营销的安卓手机品牌。它是谁？发生了什么故事和曲折？,2018/3/3,“独角兽”如何在A股上市|新刊荐读,http://finance.caixin.com/2018-03-03/101216426.html
companies,“任何时候政策允许百度回来的话，我们肯定是希望能够尽早回到国内股市。”3月2日，全国政协委员、百度董事长兼首席执行官李彦宏接受媒体采访时对百度回归国内上市表态。 李彦宏称，一直希望百度能在国内整体上市，因为主要的用户和市场都在中国，如果主要股东也在中国就是最理想的情况。他指出，当年之所以去美国去上市，是因为当时的政策不允许，“我们VIE的结构从中国法律来看是一个外资公司。”这一问题今天仍然存在着政策的障碍。 据财新记者了解，近期，证监会会同沪深交易所密集调研“BATJ”（百度、阿里巴巴、腾讯和京东）及其相关概念的企业，探讨企业经营模式的同时，向这些企业伸出A股上市邀请的橄榄枝。,2018/3/3,A股欲拥抱新经济公司 李彦宏表态希望尽早回归,http://companies.caixin.com/2018-03-03/101216405.html
datanews,2018年2月24日，第十三届全国人民代表大会代表名单公布，35个代表团共产生2980名人大代表。据财新记者统计，其中30名代表是福布斯富豪榜中排名前400的私营企业家。,2018/3/2,新一届全国人大代表来了 其中有富豪企业家30人,http://datanews.caixin.com/2018-03-02/101215890.html
