channel,content,date,title,url
finance,感恩“+”人，扫描以下二维码，关注“财新数据加”微信公号，即可领取财新商城现金券。  股票】上证指数报3353.82点，涨0.06%；沪深300收报4104.20点，涨0.04%；创业板指报1782.66点，跌0.68%。 乐视网负面不断，敏感舆情指数长居第一；尔康制药承认财务造假，敏感舆情指数第二；一汽夏利股权转让未果，重组成泡影，敏感舆情指数第三。 债券】 隔夜Shibor跌0.6bp报2.7970%，7天Shibor涨0.2bp报2.8730%，14天期Shibor涨0.20bp报3.8720%，1个月Shibor跌0.09bp报4.0379%。 机会】意大利儿童玩具企业投资机会 事件】 北京红黄蓝幼儿园涉嫌虐童 2017年11月22日晚间，有十余名幼儿家长反映朝阳区管庄红黄蓝幼儿园(新天地分园)国际小二班的幼儿遭遇老师扎针、喂不明白色药片，并提供孩子身上多个针眼的照片。目前，朝阳警方已介入事件调查。 微信支付接入12306 2017年11月23日起，中国铁路客户服务中心12306网站微信支付功能上线试运行。这是在引入互联网订餐、取消异地售票手续费、推出高铁“接续换乘”“自主选座”功能后，铁路部门实施的又一便民服务新举措。 资讯】 机构评A股大跌：政策不确定促市场回调 中长期积极因素犹在 蓝筹涨幅过大有回调压力；资管新规加速了债市抛售，风险蔓延到股票市场；但政策在中长期将改变投资者对高回报固定收益产品的依赖，并加大在股票市场的配置 Uber瞒报数据泄密曝光 各国加强监管力度 CNBC科技记者Arjun Kharpal介绍道，在Uber瞒报5700万人数据泄露一事曝光后，英、美、澳大利亚、新加坡等国监管机构都要求企业上报信息泄露类事件，以求保护用户权益。他指出互联网发展到现在这个时代，即使只泄露一个电邮地址，与该地址挂钩的很多账户就有被滥用的危险。他相信现在很多企业都私下付给黑客“赎金”以平息泄密事件，近期Uber、Equifax和雅虎的数据泄露事件已使全球监管部门加大打击相关违规操作的力度 中企海外动向】 京东领投越南电商TIKI.VN竞争东南亚市场 万安科技拟购美企Evatran拓电动车无线充电业务 “数据+”】 至12月31日，所有“财新通”用户补差价1498元，即可升级为全新一年的财新“数据+”用户； 补差价2400元，即可升级为全新两年的财新“数据+”用户。此项优惠对用户余存期限没有资格限制。,2017/11/24,11月24日财新“数据+”精华推荐,http://finance.caixin.com/2017-11-24/101175778.html
companies,大兴火灾之后，北京开展为期40天的安全隐患大排查、大清理、大整治专项行动。仓储物流是重点整治行业之一，北京快递行业面临严峻挑战。 11月22日和23日，中通、申通、圆通分别发布《告客户书》，称“配合专项行动期间，北京地区的快件中转与寄递时效将会受到一定影响”。韵达、百世快递、天天快递等企业虽未发声明，但也受到影响。整治行动究竟影响了多少个快递网点，各家均未明确回应。 一位百世快递的快递员告诉财新记者，其所在站点仓库已经停电、办公室也被查封，外地发来的货只能露天分拣。现在只收件、发往外地，“电动车没地儿充电，到处打游击。11月22日，‘通达系’一家公司在北京有45个站点被停，还有一家公司停了20多个站点。”,2017/11/23,受安全隐患排查影响 北京部分快递站点被清理,http://companies.caixin.com/2017-11-23/101175454.html
finance,就在公示了5家拟备案P2P平台后，厦门市金融办昨日（11月22日）又发出了《关于进一步规范网贷机构管理工作的公告》，重申暂缓对名称或经营范围含“网贷”、“网络借贷”、“P2P”等字样的企业进行工商登记。 公告指出，对恶意炒卖企业名称、违规变更股权、扰乱市场秩序等行为，金融办将会同相关部门予以打击，依法追究相关人员法律责任。同时强调，金融监管部门对P2P备案登记，不构成对机构经营能力、合规程度、资信状况的认可和评价。,2017/11/23,厦门重申暂缓P2P工商登记 称将对恶意炒壳予以打击,http://finance.caixin.com/2017-11-23/101175275.html
china,大数据技术助力破解执行难。11月21日，北京市第四中级法院（下称北京四中院）执行财产处置辅助系统上线，该系统依托京东公司大数据信息技术开发，旨在借助现代化信息技术手段提高财产处置效率、破解执行难。据了解，这是北京法院在这方面的首次尝试。 司法实践中，被执行人财产难以变现是执行难的典型表现。因此，执行财产处置常常面临拍品评估周期长、评估价格起伏大、拍品定价难、推广难等问题，一定程度上降低了执行财产处置效率。此次上线的执行财产处置辅助系统通过大数据分析与应用，具备了智能评估、拍卖预测、信息告知、拍品推广及法规查询等功能，有助于解决上述难题。,2017/11/22,北京法院首个执行财产处置辅助系统上线 可智能评估房价,http://china.caixin.com/2017-11-22/101174646.html
opinion,"监管机构作为金融科技大家庭里的家长，膝下有4个子女： 老大是第三方支付，别名支付宝或者微信支付，老大是家里的骄傲。他经过10年奋斗，如今名扬海内外，成为家长出门都要带上的一张值得炫耀的名片。邻居称赞他为“中国新四大发明”之首。 老二叫货币市场基金，俗称余额宝，老二是家里的宝贝。含着金汤匙出生的他，碰上天时地利人和，成为中国金融科技发展的导火索。由于老二长得讨喜，人见人爱，亲戚朋友给他的零食吃太多，如今已经胖到世界第一，也招来了各种羡慕嫉妒恨，于是他开始努力节食减肥。 老三是家里的独女，叫现金贷，她是家里的烦恼。她妖艳美丽，一出生就充满争议。她的快速成长招来各界流言蜚语，长大后和一个叫高利贷的混混暧昧不清，更是引发众议。她最近在邻居家高调亮相，融了一大笔钱回来，却因言语不当激起众人口诛笔伐。家长为她操碎了心。 老四叫网络借贷，别名P2P，是家里的实干派，家长对他爱恨交加。他的人生大起大落，颇为波折。曾经被认为最能推动普惠金融的创新，他受到家长的支持和各界的欢迎。却因为太过任性，他连续犯了几个大错。国有国法，家有家规，家长不得不出手严管，相继出台相应的管理指导意见和管理框架，并勒令他面壁思过，限期整改。 在整改的日子里，老四被舆论唾弃，有点抬不起头来。再加上交易量停止增长甚至萎缩，他日渐消瘦，萎靡不振。茫然和徘徊中，他迫切期待监管细则的真正落地，才能以此为契机，重新再出发，走上规范发展的道路。 11月16日，厦门市金融办发布《关于网贷机构备案公示的通知》，对5家拟备案企业予以公示，公示时间为11月16日至11月25日。5家拟备案的企业对应的平台分别是农金宝互金、日日进、乾方位、易利贷和京东旭航（京东金融旗下新建的子公司）。  这意味着， 这5家企业将可能成为全国第一批备案的P2P平台。 从指导意见到管理指引，从管理办法再到备案公示，监管从大到小、从粗到细，最后进入实质执行阶段，这无疑是P2P行业所翘首期盼的重大喜讯。 备案不是背书 在主管机关备案并不是对P2P的背书。 央行行长周小川最近在央行官网发文称“金融是特许经营行业”。 金融的特殊性，决定金融业务必须经过监管批准后才能开展业务。对金融业务的批准有两种方式：牌照制和备案制。 牌照属于事前监管，条件严格和苛刻，一般都用于金融行业中重要的机构比如银行、保险、信托、券商等。由于数量有限，因此牌照价值不菲，也因此衍生出牌照炒作等乱象。同时水涨船高的金融牌照增加了新创企业准入的门槛，助长了金融行业的垄断。备案制属于事中监管，条件相对宽松，只要符合条件，都可以申请备案。相比牌照制，备案制比较灵活， 因此适合创新的金融科技企业。 银监会2016年10月出台《网络借贷信息中介机构备案登记管理指引》之前，曾经对P2P采用牌照还是备案有不小的争论。最后，银监会选择相对灵活的备案制，体现了监管对P2P行业既要加强引导同时鼓励创新的思维。 如今，在距2018年6月互联网金融整改最后期限只剩半年的时间里，P2P备案在厦门率先开展。全国众多“身份”迷茫的P2P， 看到取得合法身份的一线希望，欣喜若狂。 但是合法身份并不能保障今后不会犯法犯规。备案只能证明P2P企业在申请备案的时候，信息真实可靠，没有违法违规。投资人应该清醒认识到，不管是牌照还是备案，都不表示监管对P2P未来运营的背书。正如厦门金融办在备案管理办法细则中强调的：""备案登记不构成对网贷机构经营能力、合规程度、资信状况的认可和评价，不作为出借人资产安全的保证。” 即使是获得极其严格的银行牌照后，银行都有可能倒闭，何况是通过备案的P2P企业。备案只是合规经营道路上的起点。 仅凭P2P申请通过备案就误以为政府为之担保背书，这是刚性兑付思维的体现。 刚性兑付是中国金融的顽疾，体现在投资群众认为机构和监管，需要为投资的回报“打包票”。若投资损失，民众就找企业保本，若是企业无法承担，则发牌照或者备案的主管机关就成为替罪之羊。这是金融参与者包括个人和机构不成熟的标志。央行等五部委于11月17日发布了《关于规范金融机构资产管理业务的指导意见（征求意见稿）》，专列一章阐述打破刚性兑付的监管要求，就是为了解决机构提供刚性兑付金融产品的问题。 投资有风险，责任和回报都需要投资人承担。事实上，没有哪家机构能保证投资回报。除了人民币和国债外，政府也无法对任何金融产品的回报背书。 由于刚性兑付的恶习根深蒂固，投资民众缺乏“买者自负”的良好投资习惯，因此在推行P2P备案落实过程中，监管和企业应该担起民众金融教育的重担。例如在显示P2P企业已经在主管机关备案的同时，应明确标注风险提示，不可误导投资人。 厦门P2P备案的落实打破了僵局，对于网贷行业合规化进程来说，这是一个积极的信号。眼看就快走出迷茫，走上正轨了，P2P兴高采烈，可是一旁足深陷的现金贷却愁眉紧锁。  现金贷和P2P这对姐弟血缘关系不浅，很多现金贷企业都由早期P2P企业转型而来，目前也有很多网络借贷公司通过网络小贷牌照涉足现金贷业务。11月21日晚，互联网金融风险专项整治工作领导办公室要求各地立即暂停批设网络小贷公司，原因是部分网络小贷公司涉足现金贷业务存在较大风险隐患。这表明对现金贷的监管已经提上日程。 P2P监管的成功探索，也许能为即将到来的现金贷治理，提供很好的参考和启发。作为家长的监管机构，肩上背负历史重任：让现金贷和P2P一起，在推动中国普惠金融发展进程中，更好地发挥积极作用。 私房课】去中国化后，比特币仍在演绎着技术与资本的神话。互联网金融千人会联合创始人、金融科技专家蔡凯龙为你讲述比特币未来何去何从，它还会回来吗？ 课程详情请点击链接：《去中国化后，比特币的现在与未来》",2017/11/22,P2P备案终落地，现金贷还遥远吗,http://opinion.caixin.com/2017-11-22/101174594.html
finance,现金贷正式被纳入监管，清理整顿开始了。 11月21日，互联网金融风险专项整治工作领导小组办公室（下称互金整治办）下发文件，要求地方金融监管部门一律不得新批网络小贷公司牌照，并禁止新增批小贷公司跨省开展小贷业务。（见财新网“整治现金贷第一步 互金整治办叫停新设网络小贷”） 11月17日，国家互联网金融安全技术专家委员会秘书长吴震表示，当前从事现金贷业务的平台有2693家，主要分布在广东、北京、上海三个地区。而据财新记者确认，到2017年6月底，其中经金融办批准，可在网上放贷的小贷公司近200家。,2017/11/22,独家|整治现金贷第二步 助贷模式将被叫停,http://finance.caixin.com/2017-11-22/101174456.html
